
         /\      Grafana   /‾‾/  
    /\  /  \     |\  __   /  /   
   /  \/    \    | |/ /  /   ‾‾\ 
  /          \   |   (  |  (‾)  |
 / __________ \  |_|\_\  \_____/ 

     execution: local
        script: load-test.js
        output: -

     scenarios: (100.00%) 2 scenarios, 550 max VUs, 1m30s max duration (incl. graceful stop):
              * complex_test: 10.00 iterations/s for 1m0s (maxVUs: 50, exec: cpuBoundTest, gracefulStop: 30s)
              * io_test: 200.00 iterations/s for 1m0s (maxVUs: 500, exec: ioBoundTest, gracefulStop: 30s)


running (0m00.9s), 121/550 VUs, 71 complete and 0 interrupted iterations
complex_test   [   2% ] 10/50 VUs    0m00.9s/1m0s  10.00 iters/s
io_test        [   2% ] 111/500 VUs  0m00.9s/1m0s  200.00 iters/s

running (0m01.9s), 287/550 VUs, 115 complete and 0 interrupted iterations
complex_test   [   3% ] 20/50 VUs    0m01.9s/1m0s  10.00 iters/s
io_test        [   3% ] 267/500 VUs  0m01.9s/1m0s  200.00 iters/s

running (0m02.9s), 451/550 VUs, 161 complete and 0 interrupted iterations
complex_test   [   5% ] 30/50 VUs    0m02.9s/1m0s  10.00 iters/s
io_test        [   5% ] 421/500 VUs  0m02.9s/1m0s  200.00 iters/s

running (0m03.9s), 540/550 VUs, 186 complete and 0 interrupted iterations
complex_test   [   7% ] 40/50 VUs    0m03.9s/1m0s  10.00 iters/s
io_test        [   7% ] 500/500 VUs  0m03.9s/1m0s  200.00 iters/s

running (0m04.9s), 550/550 VUs, 200 complete and 0 interrupted iterations
complex_test   [   8% ] 50/50 VUs    0m04.9s/1m0s  10.00 iters/s
io_test        [   8% ] 500/500 VUs  0m04.9s/1m0s  200.00 iters/s

running (0m05.9s), 550/550 VUs, 217 complete and 0 interrupted iterations
complex_test   [  10% ] 50/50 VUs    0m05.9s/1m0s  10.00 iters/s
io_test        [  10% ] 500/500 VUs  0m05.9s/1m0s  200.00 iters/s

running (0m06.9s), 550/550 VUs, 223 complete and 0 interrupted iterations
complex_test   [  12% ] 50/50 VUs    0m06.9s/1m0s  10.00 iters/s
io_test        [  12% ] 500/500 VUs  0m06.9s/1m0s  200.00 iters/s

running (0m07.9s), 550/550 VUs, 243 complete and 0 interrupted iterations
complex_test   [  13% ] 50/50 VUs    0m07.9s/1m0s  10.00 iters/s
io_test        [  13% ] 500/500 VUs  0m07.9s/1m0s  200.00 iters/s

running (0m08.9s), 550/550 VUs, 287 complete and 0 interrupted iterations
complex_test   [  15% ] 50/50 VUs    0m08.9s/1m0s  10.00 iters/s
io_test        [  15% ] 500/500 VUs  0m08.9s/1m0s  200.00 iters/s

running (0m09.9s), 550/550 VUs, 301 complete and 0 interrupted iterations
complex_test   [  17% ] 50/50 VUs    0m09.9s/1m0s  10.00 iters/s
io_test        [  17% ] 500/500 VUs  0m09.9s/1m0s  200.00 iters/s

running (0m10.9s), 550/550 VUs, 315 complete and 0 interrupted iterations
complex_test   [  18% ] 50/50 VUs    0m10.9s/1m0s  10.00 iters/s
io_test        [  18% ] 500/500 VUs  0m10.9s/1m0s  200.00 iters/s

running (0m11.9s), 550/550 VUs, 335 complete and 0 interrupted iterations
complex_test   [  20% ] 50/50 VUs    0m11.9s/1m0s  10.00 iters/s
io_test        [  20% ] 500/500 VUs  0m11.9s/1m0s  200.00 iters/s

running (0m12.9s), 550/550 VUs, 343 complete and 0 interrupted iterations
complex_test   [  22% ] 50/50 VUs    0m12.9s/1m0s  10.00 iters/s
io_test        [  22% ] 500/500 VUs  0m12.9s/1m0s  200.00 iters/s

running (0m13.9s), 550/550 VUs, 366 complete and 0 interrupted iterations
complex_test   [  23% ] 50/50 VUs    0m13.9s/1m0s  10.00 iters/s
io_test        [  23% ] 500/500 VUs  0m13.9s/1m0s  200.00 iters/s

running (0m14.9s), 550/550 VUs, 377 complete and 0 interrupted iterations
complex_test   [  25% ] 50/50 VUs    0m14.9s/1m0s  10.00 iters/s
io_test        [  25% ] 500/500 VUs  0m14.9s/1m0s  200.00 iters/s

running (0m15.9s), 550/550 VUs, 392 complete and 0 interrupted iterations
complex_test   [  27% ] 50/50 VUs    0m15.9s/1m0s  10.00 iters/s
io_test        [  27% ] 500/500 VUs  0m15.9s/1m0s  200.00 iters/s

running (0m16.9s), 550/550 VUs, 413 complete and 0 interrupted iterations
complex_test   [  28% ] 50/50 VUs    0m16.9s/1m0s  10.00 iters/s
io_test        [  28% ] 500/500 VUs  0m16.9s/1m0s  200.00 iters/s

running (0m17.9s), 550/550 VUs, 426 complete and 0 interrupted iterations
complex_test   [  30% ] 50/50 VUs    0m17.9s/1m0s  10.00 iters/s
io_test        [  30% ] 500/500 VUs  0m17.9s/1m0s  200.00 iters/s

running (0m18.9s), 550/550 VUs, 442 complete and 0 interrupted iterations
complex_test   [  32% ] 50/50 VUs    0m18.9s/1m0s  10.00 iters/s
io_test        [  32% ] 500/500 VUs  0m18.9s/1m0s  200.00 iters/s

running (0m19.9s), 550/550 VUs, 467 complete and 0 interrupted iterations
complex_test   [  33% ] 50/50 VUs    0m19.9s/1m0s  10.00 iters/s
io_test        [  33% ] 500/500 VUs  0m19.9s/1m0s  200.00 iters/s

running (0m20.9s), 550/550 VUs, 502 complete and 0 interrupted iterations
complex_test   [  35% ] 50/50 VUs    0m20.9s/1m0s  10.00 iters/s
io_test        [  35% ] 500/500 VUs  0m20.9s/1m0s  200.00 iters/s

running (0m21.9s), 550/550 VUs, 522 complete and 0 interrupted iterations
complex_test   [  37% ] 50/50 VUs    0m21.9s/1m0s  10.00 iters/s
io_test        [  37% ] 500/500 VUs  0m21.9s/1m0s  200.00 iters/s

running (0m22.9s), 550/550 VUs, 535 complete and 0 interrupted iterations
complex_test   [  38% ] 50/50 VUs    0m22.9s/1m0s  10.00 iters/s
io_test        [  38% ] 500/500 VUs  0m22.9s/1m0s  200.00 iters/s

running (0m23.9s), 550/550 VUs, 545 complete and 0 interrupted iterations
complex_test   [  40% ] 50/50 VUs    0m23.9s/1m0s  10.00 iters/s
io_test        [  40% ] 500/500 VUs  0m23.9s/1m0s  200.00 iters/s

running (0m24.9s), 550/550 VUs, 558 complete and 0 interrupted iterations
complex_test   [  42% ] 50/50 VUs    0m24.9s/1m0s  10.00 iters/s
io_test        [  42% ] 500/500 VUs  0m24.9s/1m0s  200.00 iters/s

running (0m25.9s), 550/550 VUs, 581 complete and 0 interrupted iterations
complex_test   [  43% ] 50/50 VUs    0m25.9s/1m0s  10.00 iters/s
io_test        [  43% ] 500/500 VUs  0m25.9s/1m0s  200.00 iters/s

running (0m26.9s), 550/550 VUs, 602 complete and 0 interrupted iterations
complex_test   [  45% ] 50/50 VUs    0m26.9s/1m0s  10.00 iters/s
io_test        [  45% ] 500/500 VUs  0m26.9s/1m0s  200.00 iters/s

running (0m27.9s), 550/550 VUs, 622 complete and 0 interrupted iterations
complex_test   [  47% ] 50/50 VUs    0m27.9s/1m0s  10.00 iters/s
io_test        [  47% ] 500/500 VUs  0m27.9s/1m0s  200.00 iters/s

running (0m28.9s), 550/550 VUs, 633 complete and 0 interrupted iterations
complex_test   [  48% ] 50/50 VUs    0m28.9s/1m0s  10.00 iters/s
io_test        [  48% ] 500/500 VUs  0m28.9s/1m0s  200.00 iters/s

running (0m29.9s), 550/550 VUs, 649 complete and 0 interrupted iterations
complex_test   [  50% ] 50/50 VUs    0m29.9s/1m0s  10.00 iters/s
io_test        [  50% ] 500/500 VUs  0m29.9s/1m0s  200.00 iters/s

running (0m30.9s), 550/550 VUs, 660 complete and 0 interrupted iterations
complex_test   [  52% ] 50/50 VUs    0m30.9s/1m0s  10.00 iters/s
io_test        [  52% ] 500/500 VUs  0m30.9s/1m0s  200.00 iters/s

running (0m31.9s), 550/550 VUs, 670 complete and 0 interrupted iterations
complex_test   [  53% ] 50/50 VUs    0m31.9s/1m0s  10.00 iters/s
io_test        [  53% ] 500/500 VUs  0m31.9s/1m0s  200.00 iters/s

running (0m32.9s), 550/550 VUs, 675 complete and 0 interrupted iterations
complex_test   [  55% ] 50/50 VUs    0m32.9s/1m0s  10.00 iters/s
io_test        [  55% ] 500/500 VUs  0m32.9s/1m0s  200.00 iters/s

running (0m33.9s), 550/550 VUs, 700 complete and 0 interrupted iterations
complex_test   [  57% ] 50/50 VUs    0m33.9s/1m0s  10.00 iters/s
io_test        [  57% ] 500/500 VUs  0m33.9s/1m0s  200.00 iters/s

running (0m34.9s), 550/550 VUs, 709 complete and 0 interrupted iterations
complex_test   [  58% ] 50/50 VUs    0m34.9s/1m0s  10.00 iters/s
io_test        [  58% ] 500/500 VUs  0m34.9s/1m0s  200.00 iters/s

running (0m35.9s), 550/550 VUs, 720 complete and 0 interrupted iterations
complex_test   [  60% ] 50/50 VUs    0m35.9s/1m0s  10.00 iters/s
io_test        [  60% ] 500/500 VUs  0m35.9s/1m0s  200.00 iters/s

running (0m36.9s), 550/550 VUs, 733 complete and 0 interrupted iterations
complex_test   [  62% ] 50/50 VUs    0m36.9s/1m0s  10.00 iters/s
io_test        [  62% ] 500/500 VUs  0m36.9s/1m0s  200.00 iters/s

running (0m37.9s), 550/550 VUs, 762 complete and 0 interrupted iterations
complex_test   [  63% ] 50/50 VUs    0m37.9s/1m0s  10.00 iters/s
io_test        [  63% ] 500/500 VUs  0m37.9s/1m0s  200.00 iters/s

running (0m38.9s), 550/550 VUs, 822 complete and 0 interrupted iterations
complex_test   [  65% ] 50/50 VUs    0m38.9s/1m0s  10.00 iters/s
io_test        [  65% ] 500/500 VUs  0m38.9s/1m0s  200.00 iters/s

running (0m39.9s), 550/550 VUs, 874 complete and 0 interrupted iterations
complex_test   [  67% ] 50/50 VUs    0m39.9s/1m0s  10.00 iters/s
io_test        [  67% ] 500/500 VUs  0m39.9s/1m0s  200.00 iters/s

running (0m40.9s), 549/550 VUs, 933 complete and 0 interrupted iterations
complex_test   [  68% ] 49/50 VUs    0m40.9s/1m0s  10.00 iters/s
io_test        [  68% ] 500/500 VUs  0m40.9s/1m0s  200.00 iters/s

running (0m41.9s), 550/550 VUs, 966 complete and 0 interrupted iterations
complex_test   [  70% ] 50/50 VUs    0m41.9s/1m0s  10.00 iters/s
io_test        [  70% ] 500/500 VUs  0m41.9s/1m0s  200.00 iters/s

running (0m42.9s), 550/550 VUs, 993 complete and 0 interrupted iterations
complex_test   [  72% ] 50/50 VUs    0m42.9s/1m0s  10.00 iters/s
io_test        [  72% ] 500/500 VUs  0m42.9s/1m0s  200.00 iters/s

running (0m43.9s), 550/550 VUs, 1018 complete and 0 interrupted iterations
complex_test   [  73% ] 50/50 VUs    0m43.9s/1m0s  10.00 iters/s
io_test        [  73% ] 500/500 VUs  0m43.9s/1m0s  200.00 iters/s

running (0m44.9s), 550/550 VUs, 1048 complete and 0 interrupted iterations
complex_test   [  75% ] 50/50 VUs    0m44.9s/1m0s  10.00 iters/s
io_test        [  75% ] 500/500 VUs  0m44.9s/1m0s  200.00 iters/s

running (0m45.9s), 550/550 VUs, 1067 complete and 0 interrupted iterations
complex_test   [  77% ] 50/50 VUs    0m45.9s/1m0s  10.00 iters/s
io_test        [  77% ] 500/500 VUs  0m45.9s/1m0s  200.00 iters/s

running (0m46.9s), 550/550 VUs, 1117 complete and 0 interrupted iterations
complex_test   [  78% ] 50/50 VUs    0m46.9s/1m0s  10.00 iters/s
io_test        [  78% ] 500/500 VUs  0m46.9s/1m0s  200.00 iters/s

running (0m47.9s), 550/550 VUs, 1148 complete and 0 interrupted iterations
complex_test   [  80% ] 50/50 VUs    0m47.9s/1m0s  10.00 iters/s
io_test        [  80% ] 500/500 VUs  0m47.9s/1m0s  200.00 iters/s

running (0m48.9s), 550/550 VUs, 1189 complete and 0 interrupted iterations
complex_test   [  82% ] 50/50 VUs    0m48.9s/1m0s  10.00 iters/s
io_test        [  82% ] 500/500 VUs  0m48.9s/1m0s  200.00 iters/s

running (0m49.9s), 550/550 VUs, 1219 complete and 0 interrupted iterations
complex_test   [  83% ] 50/50 VUs    0m49.9s/1m0s  10.00 iters/s
io_test        [  83% ] 500/500 VUs  0m49.9s/1m0s  200.00 iters/s

running (0m50.9s), 550/550 VUs, 1244 complete and 0 interrupted iterations
complex_test   [  85% ] 50/50 VUs    0m50.9s/1m0s  10.00 iters/s
io_test        [  85% ] 500/500 VUs  0m50.9s/1m0s  200.00 iters/s

running (0m51.9s), 550/550 VUs, 1275 complete and 0 interrupted iterations
complex_test   [  87% ] 50/50 VUs    0m51.9s/1m0s  10.00 iters/s
io_test        [  87% ] 500/500 VUs  0m51.9s/1m0s  200.00 iters/s

running (0m52.9s), 550/550 VUs, 1309 complete and 0 interrupted iterations
complex_test   [  88% ] 50/50 VUs    0m52.9s/1m0s  10.00 iters/s
io_test        [  88% ] 500/500 VUs  0m52.9s/1m0s  200.00 iters/s

running (0m53.9s), 550/550 VUs, 1334 complete and 0 interrupted iterations
complex_test   [  90% ] 50/50 VUs    0m53.9s/1m0s  10.00 iters/s
io_test        [  90% ] 500/500 VUs  0m53.9s/1m0s  200.00 iters/s

running (0m54.9s), 550/550 VUs, 1360 complete and 0 interrupted iterations
complex_test   [  92% ] 50/50 VUs    0m54.9s/1m0s  10.00 iters/s
io_test        [  92% ] 500/500 VUs  0m54.9s/1m0s  200.00 iters/s

running (0m55.9s), 550/550 VUs, 1381 complete and 0 interrupted iterations
complex_test   [  93% ] 50/50 VUs    0m55.9s/1m0s  10.00 iters/s
io_test        [  93% ] 500/500 VUs  0m55.9s/1m0s  200.00 iters/s

running (0m56.9s), 550/550 VUs, 1399 complete and 0 interrupted iterations
complex_test   [  95% ] 50/50 VUs    0m56.9s/1m0s  10.00 iters/s
io_test        [  95% ] 500/500 VUs  0m56.9s/1m0s  200.00 iters/s

running (0m57.9s), 550/550 VUs, 1437 complete and 0 interrupted iterations
complex_test   [  97% ] 50/50 VUs    0m57.9s/1m0s  10.00 iters/s
io_test        [  97% ] 500/500 VUs  0m57.9s/1m0s  200.00 iters/s

running (0m58.9s), 550/550 VUs, 1458 complete and 0 interrupted iterations
complex_test   [  98% ] 50/50 VUs    0m58.9s/1m0s  10.00 iters/s
io_test        [  98% ] 500/500 VUs  0m58.9s/1m0s  200.00 iters/s

running (0m59.9s), 550/550 VUs, 1473 complete and 0 interrupted iterations
complex_test   [ 100% ] 50/50 VUs    0m59.9s/1m0s  10.00 iters/s
io_test        [ 100% ] 500/500 VUs  0m59.9s/1m0s  200.00 iters/s

running (1m00.9s), 533/550 VUs, 1490 complete and 0 interrupted iterations
complex_test ↓ [ 100% ] 50/50 VUs    1m0s  10.00 iters/s
io_test      ↓ [ 100% ] 500/500 VUs  1m0s  200.00 iters/s

running (1m01.9s), 483/550 VUs, 1540 complete and 0 interrupted iterations
complex_test ↓ [ 100% ] 50/50 VUs    1m0s  10.00 iters/s
io_test      ↓ [ 100% ] 500/500 VUs  1m0s  200.00 iters/s

running (1m02.9s), 441/550 VUs, 1582 complete and 0 interrupted iterations
complex_test ↓ [ 100% ] 50/50 VUs    1m0s  10.00 iters/s
io_test      ↓ [ 100% ] 500/500 VUs  1m0s  200.00 iters/s

running (1m03.9s), 409/550 VUs, 1614 complete and 0 interrupted iterations
complex_test ↓ [ 100% ] 50/50 VUs    1m0s  10.00 iters/s
io_test      ↓ [ 100% ] 500/500 VUs  1m0s  200.00 iters/s

running (1m04.9s), 379/550 VUs, 1644 complete and 0 interrupted iterations
complex_test ↓ [ 100% ] 50/50 VUs    1m0s  10.00 iters/s
io_test      ↓ [ 100% ] 500/500 VUs  1m0s  200.00 iters/s

running (1m05.9s), 345/550 VUs, 1678 complete and 0 interrupted iterations
complex_test ↓ [ 100% ] 50/50 VUs    1m0s  10.00 iters/s
io_test      ↓ [ 100% ] 500/500 VUs  1m0s  200.00 iters/s

running (1m06.9s), 318/550 VUs, 1705 complete and 0 interrupted iterations
complex_test ↓ [ 100% ] 50/50 VUs    1m0s  10.00 iters/s
io_test      ↓ [ 100% ] 500/500 VUs  1m0s  200.00 iters/s

running (1m07.9s), 259/550 VUs, 1764 complete and 0 interrupted iterations
complex_test ↓ [ 100% ] 50/50 VUs    1m0s  10.00 iters/s
io_test      ↓ [ 100% ] 500/500 VUs  1m0s  200.00 iters/s

running (1m08.9s), 220/550 VUs, 1803 complete and 0 interrupted iterations
complex_test ↓ [ 100% ] 50/50 VUs    1m0s  10.00 iters/s
io_test      ↓ [ 100% ] 500/500 VUs  1m0s  200.00 iters/s

running (1m09.9s), 158/550 VUs, 1865 complete and 0 interrupted iterations
complex_test ↓ [ 100% ] 50/50 VUs    1m0s  10.00 iters/s
io_test      ↓ [ 100% ] 500/500 VUs  1m0s  200.00 iters/s

running (1m10.9s), 090/550 VUs, 1933 complete and 0 interrupted iterations
complex_test ↓ [ 100% ] 50/50 VUs    1m0s  10.00 iters/s
io_test      ↓ [ 100% ] 500/500 VUs  1m0s  200.00 iters/s


  █ THRESHOLDS 

    complex_calc_time_ms
    ✗ 'p(95)<1000' p(95)=35291.6

    http_req_duration
    ✗ 'p(95)<500' p(95)=53.52s

    http_req_failed
    ✗ 'rate<0.01' rate=3.31%


  █ TOTAL RESULTS 

    checks_total.......: 2023   28.247688/s
    checks_succeeded...: 96.68% 1956 out of 2023
    checks_failed......: 3.31%  67 out of 2023

    ✗ IO: status is 200
      ↳  97% — ✓ 1867 / ✗ 57
    ✗ CPU: status is 200
      ↳  89% — ✓ 89 / ✗ 10

    CUSTOM
    complex_calc_time_ms...........: avg=22518.258427 min=1833     med=18606  max=36003  p(90)=34919.6 p(95)=35291.6

    HTTP
    http_req_duration..............: avg=17.59s       min=1ms      med=12.69s max=1m0s   p(90)=42.65s  p(95)=53.52s 
      { expected_response:true }...: avg=16.14s       min=1ms      med=12.08s max=59.42s p(90)=38.55s  p(95)=45.67s 
    http_req_failed................: 3.31%  67 out of 2023
    http_reqs......................: 2023   28.247688/s

    EXECUTION
    dropped_iterations.............: 10578  147.703433/s
    iteration_duration.............: avg=17.69s       min=101.41ms med=12.79s max=1m0s   p(90)=42.75s  p(95)=53.62s 
    iterations.....................: 2023   28.247688/s
    vus............................: 90     min=90         max=550
    vus_max........................: 550    min=550        max=550

    NETWORK
    data_received..................: 266 kB 3.7 kB/s
    data_sent......................: 156 kB 2.2 kB/s




running (1m11.6s), 000/550 VUs, 2023 complete and 0 interrupted iterations
complex_test ✓ [ 100% ] 00/50 VUs    1m0s  10.00 iters/s
io_test      ✓ [ 100% ] 000/500 VUs  1m0s  200.00 iters/s
