
         /\      Grafana   /‾‾/  
    /\  /  \     |\  __   /  /   
   /  \/    \    | |/ /  /   ‾‾\ 
  /          \   |   (  |  (‾)  |
 / __________ \  |_|\_\  \_____/ 

     execution: local
        script: load-test.js
        output: -

     scenarios: (100.00%) 2 scenarios, 550 max VUs, 1m30s max duration (incl. graceful stop):
              * complex_test: 10.00 iterations/s for 1m0s (maxVUs: 50, exec: cpuBoundTest, gracefulStop: 30s)
              * io_test: 200.00 iterations/s for 1m0s (maxVUs: 500, exec: ioBoundTest, gracefulStop: 30s)


running (0m00.9s), 197/550 VUs, 0 complete and 0 interrupted iterations
complex_test   [   2% ] 10/50 VUs    0m00.9s/1m0s  10.00 iters/s
io_test        [   2% ] 187/500 VUs  0m00.9s/1m0s  200.00 iters/s

running (0m01.9s), 406/550 VUs, 0 complete and 0 interrupted iterations
complex_test   [   3% ] 20/50 VUs    0m01.9s/1m0s  10.00 iters/s
io_test        [   3% ] 386/500 VUs  0m01.9s/1m0s  200.00 iters/s

running (0m02.9s), 530/550 VUs, 0 complete and 0 interrupted iterations
complex_test   [   5% ] 30/50 VUs    0m02.9s/1m0s  10.00 iters/s
io_test        [   5% ] 500/500 VUs  0m02.9s/1m0s  200.00 iters/s

running (0m03.9s), 540/550 VUs, 0 complete and 0 interrupted iterations
complex_test   [   7% ] 40/50 VUs    0m03.9s/1m0s  10.00 iters/s
io_test        [   7% ] 500/500 VUs  0m03.9s/1m0s  200.00 iters/s

running (0m04.9s), 550/550 VUs, 0 complete and 0 interrupted iterations
complex_test   [   8% ] 50/50 VUs    0m04.9s/1m0s  10.00 iters/s
io_test        [   8% ] 500/500 VUs  0m04.9s/1m0s  200.00 iters/s

running (0m05.9s), 550/550 VUs, 0 complete and 0 interrupted iterations
complex_test   [  10% ] 50/50 VUs    0m05.9s/1m0s  10.00 iters/s
io_test        [  10% ] 500/500 VUs  0m05.9s/1m0s  200.00 iters/s

running (0m06.9s), 550/550 VUs, 0 complete and 0 interrupted iterations
complex_test   [  12% ] 50/50 VUs    0m06.9s/1m0s  10.00 iters/s
io_test        [  12% ] 500/500 VUs  0m06.9s/1m0s  200.00 iters/s

running (0m07.9s), 550/550 VUs, 0 complete and 0 interrupted iterations
complex_test   [  13% ] 50/50 VUs    0m07.9s/1m0s  10.00 iters/s
io_test        [  13% ] 500/500 VUs  0m07.9s/1m0s  200.00 iters/s

running (0m08.9s), 550/550 VUs, 0 complete and 0 interrupted iterations
complex_test   [  15% ] 50/50 VUs    0m08.9s/1m0s  10.00 iters/s
io_test        [  15% ] 500/500 VUs  0m08.9s/1m0s  200.00 iters/s

running (0m09.9s), 550/550 VUs, 0 complete and 0 interrupted iterations
complex_test   [  17% ] 50/50 VUs    0m09.9s/1m0s  10.00 iters/s
io_test        [  17% ] 500/500 VUs  0m09.9s/1m0s  200.00 iters/s

running (0m10.9s), 550/550 VUs, 0 complete and 0 interrupted iterations
complex_test   [  18% ] 50/50 VUs    0m10.9s/1m0s  10.00 iters/s
io_test        [  18% ] 500/500 VUs  0m10.9s/1m0s  200.00 iters/s

running (0m11.9s), 550/550 VUs, 0 complete and 0 interrupted iterations
complex_test   [  20% ] 50/50 VUs    0m11.9s/1m0s  10.00 iters/s
io_test        [  20% ] 500/500 VUs  0m11.9s/1m0s  200.00 iters/s

running (0m12.9s), 550/550 VUs, 0 complete and 0 interrupted iterations
complex_test   [  22% ] 50/50 VUs    0m12.9s/1m0s  10.00 iters/s
io_test        [  22% ] 500/500 VUs  0m12.9s/1m0s  200.00 iters/s

running (0m13.9s), 550/550 VUs, 0 complete and 0 interrupted iterations
complex_test   [  23% ] 50/50 VUs    0m13.9s/1m0s  10.00 iters/s
io_test        [  23% ] 500/500 VUs  0m13.9s/1m0s  200.00 iters/s

running (0m14.9s), 550/550 VUs, 0 complete and 0 interrupted iterations
complex_test   [  25% ] 50/50 VUs    0m14.9s/1m0s  10.00 iters/s
io_test        [  25% ] 500/500 VUs  0m14.9s/1m0s  200.00 iters/s

running (0m15.9s), 550/550 VUs, 0 complete and 0 interrupted iterations
complex_test   [  27% ] 50/50 VUs    0m15.9s/1m0s  10.00 iters/s
io_test        [  27% ] 500/500 VUs  0m15.9s/1m0s  200.00 iters/s

running (0m16.9s), 550/550 VUs, 0 complete and 0 interrupted iterations
complex_test   [  28% ] 50/50 VUs    0m16.9s/1m0s  10.00 iters/s
io_test        [  28% ] 500/500 VUs  0m16.9s/1m0s  200.00 iters/s

running (0m17.9s), 550/550 VUs, 0 complete and 0 interrupted iterations
complex_test   [  30% ] 50/50 VUs    0m17.9s/1m0s  10.00 iters/s
io_test        [  30% ] 500/500 VUs  0m17.9s/1m0s  200.00 iters/s

running (0m18.9s), 550/550 VUs, 0 complete and 0 interrupted iterations
complex_test   [  32% ] 50/50 VUs    0m18.9s/1m0s  10.00 iters/s
io_test        [  32% ] 500/500 VUs  0m18.9s/1m0s  200.00 iters/s

running (0m19.9s), 550/550 VUs, 0 complete and 0 interrupted iterations
complex_test   [  33% ] 50/50 VUs    0m19.9s/1m0s  10.00 iters/s
io_test        [  33% ] 500/500 VUs  0m19.9s/1m0s  200.00 iters/s

running (0m20.9s), 550/550 VUs, 0 complete and 0 interrupted iterations
complex_test   [  35% ] 50/50 VUs    0m20.9s/1m0s  10.00 iters/s
io_test        [  35% ] 500/500 VUs  0m20.9s/1m0s  200.00 iters/s

running (0m21.9s), 550/550 VUs, 0 complete and 0 interrupted iterations
complex_test   [  37% ] 50/50 VUs    0m21.9s/1m0s  10.00 iters/s
io_test        [  37% ] 500/500 VUs  0m21.9s/1m0s  200.00 iters/s

running (0m22.9s), 550/550 VUs, 0 complete and 0 interrupted iterations
complex_test   [  38% ] 50/50 VUs    0m22.9s/1m0s  10.00 iters/s
io_test        [  38% ] 500/500 VUs  0m22.9s/1m0s  200.00 iters/s

running (0m23.9s), 550/550 VUs, 0 complete and 0 interrupted iterations
complex_test   [  40% ] 50/50 VUs    0m23.9s/1m0s  10.00 iters/s
io_test        [  40% ] 500/500 VUs  0m23.9s/1m0s  200.00 iters/s

running (0m24.9s), 550/550 VUs, 0 complete and 0 interrupted iterations
complex_test   [  42% ] 50/50 VUs    0m24.9s/1m0s  10.00 iters/s
io_test        [  42% ] 500/500 VUs  0m24.9s/1m0s  200.00 iters/s

running (0m25.9s), 550/550 VUs, 0 complete and 0 interrupted iterations
complex_test   [  43% ] 50/50 VUs    0m25.9s/1m0s  10.00 iters/s
io_test        [  43% ] 500/500 VUs  0m25.9s/1m0s  200.00 iters/s

running (0m26.9s), 550/550 VUs, 0 complete and 0 interrupted iterations
complex_test   [  45% ] 50/50 VUs    0m26.9s/1m0s  10.00 iters/s
io_test        [  45% ] 500/500 VUs  0m26.9s/1m0s  200.00 iters/s

running (0m27.9s), 550/550 VUs, 0 complete and 0 interrupted iterations
complex_test   [  47% ] 50/50 VUs    0m27.9s/1m0s  10.00 iters/s
io_test        [  47% ] 500/500 VUs  0m27.9s/1m0s  200.00 iters/s

running (0m28.9s), 550/550 VUs, 0 complete and 0 interrupted iterations
complex_test   [  48% ] 50/50 VUs    0m28.9s/1m0s  10.00 iters/s
io_test        [  48% ] 500/500 VUs  0m28.9s/1m0s  200.00 iters/s

running (0m29.9s), 550/550 VUs, 144 complete and 0 interrupted iterations
complex_test   [  50% ] 50/50 VUs    0m29.9s/1m0s  10.00 iters/s
io_test        [  50% ] 500/500 VUs  0m29.9s/1m0s  200.00 iters/s

running (0m30.9s), 550/550 VUs, 154 complete and 0 interrupted iterations
complex_test   [  52% ] 50/50 VUs    0m30.9s/1m0s  10.00 iters/s
io_test        [  52% ] 500/500 VUs  0m30.9s/1m0s  200.00 iters/s

running (0m31.9s), 550/550 VUs, 154 complete and 0 interrupted iterations
complex_test   [  53% ] 50/50 VUs    0m31.9s/1m0s  10.00 iters/s
io_test        [  53% ] 500/500 VUs  0m31.9s/1m0s  200.00 iters/s

running (0m32.9s), 550/550 VUs, 154 complete and 0 interrupted iterations
complex_test   [  55% ] 50/50 VUs    0m32.9s/1m0s  10.00 iters/s
io_test        [  55% ] 500/500 VUs  0m32.9s/1m0s  200.00 iters/s

running (0m33.9s), 550/550 VUs, 164 complete and 0 interrupted iterations
complex_test   [  57% ] 50/50 VUs    0m33.9s/1m0s  10.00 iters/s
io_test        [  57% ] 500/500 VUs  0m33.9s/1m0s  200.00 iters/s

running (0m34.9s), 550/550 VUs, 268 complete and 0 interrupted iterations
complex_test   [  58% ] 50/50 VUs    0m34.9s/1m0s  10.00 iters/s
io_test        [  58% ] 500/500 VUs  0m34.9s/1m0s  200.00 iters/s

running (0m35.9s), 550/550 VUs, 278 complete and 0 interrupted iterations
complex_test   [  60% ] 50/50 VUs    0m35.9s/1m0s  10.00 iters/s
io_test        [  60% ] 500/500 VUs  0m35.9s/1m0s  200.00 iters/s

running (0m36.9s), 550/550 VUs, 278 complete and 0 interrupted iterations
complex_test   [  62% ] 50/50 VUs    0m36.9s/1m0s  10.00 iters/s
io_test        [  62% ] 500/500 VUs  0m36.9s/1m0s  200.00 iters/s

running (0m37.9s), 550/550 VUs, 288 complete and 0 interrupted iterations
complex_test   [  63% ] 50/50 VUs    0m37.9s/1m0s  10.00 iters/s
io_test        [  63% ] 500/500 VUs  0m37.9s/1m0s  200.00 iters/s

running (0m38.9s), 537/550 VUs, 472 complete and 0 interrupted iterations
complex_test   [  65% ] 49/50 VUs    0m38.9s/1m0s  10.00 iters/s
io_test        [  65% ] 488/500 VUs  0m38.9s/1m0s  200.00 iters/s

running (0m39.9s), 550/550 VUs, 482 complete and 0 interrupted iterations
complex_test   [  67% ] 50/50 VUs    0m39.9s/1m0s  10.00 iters/s
io_test        [  67% ] 500/500 VUs  0m39.9s/1m0s  200.00 iters/s

running (0m40.9s), 550/550 VUs, 482 complete and 0 interrupted iterations
complex_test   [  68% ] 50/50 VUs    0m40.9s/1m0s  10.00 iters/s
io_test        [  68% ] 500/500 VUs  0m40.9s/1m0s  200.00 iters/s

running (0m41.9s), 550/550 VUs, 482 complete and 0 interrupted iterations
complex_test   [  70% ] 50/50 VUs    0m41.9s/1m0s  10.00 iters/s
io_test        [  70% ] 500/500 VUs  0m41.9s/1m0s  200.00 iters/s

running (0m42.9s), 550/550 VUs, 482 complete and 0 interrupted iterations
complex_test   [  72% ] 50/50 VUs    0m42.9s/1m0s  10.00 iters/s
io_test        [  72% ] 500/500 VUs  0m42.9s/1m0s  200.00 iters/s

running (0m43.9s), 550/550 VUs, 492 complete and 0 interrupted iterations
complex_test   [  73% ] 50/50 VUs    0m43.9s/1m0s  10.00 iters/s
io_test        [  73% ] 500/500 VUs  0m43.9s/1m0s  200.00 iters/s

running (0m44.9s), 527/550 VUs, 570 complete and 0 interrupted iterations
complex_test   [  75% ] 27/50 VUs    0m44.9s/1m0s  10.00 iters/s
io_test        [  75% ] 500/500 VUs  0m44.9s/1m0s  200.00 iters/s

running (0m45.9s), 536/550 VUs, 582 complete and 0 interrupted iterations
complex_test   [  77% ] 36/50 VUs    0m45.9s/1m0s  10.00 iters/s
io_test        [  77% ] 500/500 VUs  0m45.9s/1m0s  200.00 iters/s

running (0m46.9s), 546/550 VUs, 582 complete and 0 interrupted iterations
complex_test   [  78% ] 46/50 VUs    0m46.9s/1m0s  10.00 iters/s
io_test        [  78% ] 500/500 VUs  0m46.9s/1m0s  200.00 iters/s

running (0m47.9s), 550/550 VUs, 582 complete and 0 interrupted iterations
complex_test   [  80% ] 50/50 VUs    0m47.9s/1m0s  10.00 iters/s
io_test        [  80% ] 500/500 VUs  0m47.9s/1m0s  200.00 iters/s

running (0m48.9s), 546/550 VUs, 592 complete and 0 interrupted iterations
complex_test   [  82% ] 49/50 VUs    0m48.9s/1m0s  10.00 iters/s
io_test        [  82% ] 498/500 VUs  0m48.9s/1m0s  200.00 iters/s

running (0m49.9s), 550/550 VUs, 592 complete and 0 interrupted iterations
complex_test   [  83% ] 50/50 VUs    0m49.9s/1m0s  10.00 iters/s
io_test        [  83% ] 500/500 VUs  0m49.9s/1m0s  200.00 iters/s

running (0m50.9s), 550/550 VUs, 592 complete and 0 interrupted iterations
complex_test   [  85% ] 50/50 VUs    0m50.9s/1m0s  10.00 iters/s
io_test        [  85% ] 500/500 VUs  0m50.9s/1m0s  200.00 iters/s

running (0m51.9s), 550/550 VUs, 592 complete and 0 interrupted iterations
complex_test   [  87% ] 50/50 VUs    0m51.9s/1m0s  10.00 iters/s
io_test        [  87% ] 500/500 VUs  0m51.9s/1m0s  200.00 iters/s

running (0m52.9s), 550/550 VUs, 592 complete and 0 interrupted iterations
complex_test   [  88% ] 50/50 VUs    0m52.9s/1m0s  10.00 iters/s
io_test        [  88% ] 500/500 VUs  0m52.9s/1m0s  200.00 iters/s

running (0m53.9s), 550/550 VUs, 592 complete and 0 interrupted iterations
complex_test   [  90% ] 50/50 VUs    0m53.9s/1m0s  10.00 iters/s
io_test        [  90% ] 500/500 VUs  0m53.9s/1m0s  200.00 iters/s

running (0m54.9s), 550/550 VUs, 592 complete and 0 interrupted iterations
complex_test   [  92% ] 50/50 VUs    0m54.9s/1m0s  10.00 iters/s
io_test        [  92% ] 500/500 VUs  0m54.9s/1m0s  200.00 iters/s

running (0m55.9s), 550/550 VUs, 592 complete and 0 interrupted iterations
complex_test   [  93% ] 50/50 VUs    0m55.9s/1m0s  10.00 iters/s
io_test        [  93% ] 500/500 VUs  0m55.9s/1m0s  200.00 iters/s

running (0m56.9s), 550/550 VUs, 592 complete and 0 interrupted iterations
complex_test   [  95% ] 50/50 VUs    0m56.9s/1m0s  10.00 iters/s
io_test        [  95% ] 500/500 VUs  0m56.9s/1m0s  200.00 iters/s

running (0m57.9s), 550/550 VUs, 592 complete and 0 interrupted iterations
complex_test   [  97% ] 50/50 VUs    0m57.9s/1m0s  10.00 iters/s
io_test        [  97% ] 500/500 VUs  0m57.9s/1m0s  200.00 iters/s

running (0m58.9s), 550/550 VUs, 592 complete and 0 interrupted iterations
complex_test   [  98% ] 50/50 VUs    0m58.9s/1m0s  10.00 iters/s
io_test        [  98% ] 500/500 VUs  0m58.9s/1m0s  200.00 iters/s

running (0m59.9s), 550/550 VUs, 592 complete and 0 interrupted iterations
complex_test   [ 100% ] 50/50 VUs    0m59.9s/1m0s  10.00 iters/s
io_test        [ 100% ] 500/500 VUs  0m59.9s/1m0s  200.00 iters/s

running (1m00.9s), 550/550 VUs, 592 complete and 0 interrupted iterations
complex_test ↓ [ 100% ] 50/50 VUs    1m0s  10.00 iters/s
io_test      ↓ [ 100% ] 500/500 VUs  1m0s  200.00 iters/s

running (1m01.9s), 550/550 VUs, 592 complete and 0 interrupted iterations
complex_test ↓ [ 100% ] 50/50 VUs    1m0s  10.00 iters/s
io_test      ↓ [ 100% ] 500/500 VUs  1m0s  200.00 iters/s

running (1m02.9s), 540/550 VUs, 602 complete and 0 interrupted iterations
complex_test ↓ [ 100% ] 50/50 VUs    1m0s  10.00 iters/s
io_test      ↓ [ 100% ] 500/500 VUs  1m0s  200.00 iters/s


  █ THRESHOLDS 

    complex_calc_time_ms
    ✓ 'p(95)<1000' p(95)=723.696984

    http_req_duration
    ✗ 'p(95)<500' p(95)=40.78s

    http_req_failed
    ✓ 'rate<0.01' rate=0.78%


  █ TOTAL RESULTS 

    checks_total.......: 1142   17.94265/s
    checks_succeeded...: 99.21% 1133 out of 1142
    checks_failed......: 0.78%  9 out of 1142

    ✗ IO: status is 200
      ↳  99% — ✓ 1031 / ✗ 9
    ✓ CPU: status is 200

    CUSTOM
    complex_calc_time_ms...........: avg=603.423276 min=562.723083 med=574.000031 max=1154.04738 p(90)=662.554171 p(95)=723.696984

    HTTP
    http_req_duration..............: avg=29.56s     min=14.54s     med=28.91s     max=42.15s     p(90)=36.52s     p(95)=40.78s    
      { expected_response:true }...: avg=29.56s     min=14.54s     med=28.9s      max=42.15s     p(90)=36.52s     p(95)=40.79s    
    http_req_failed................: 0.78%  9 out of 1142
    http_reqs......................: 1142   17.94265/s

    EXECUTION
    dropped_iterations.............: 11460  180.054962/s
    iteration_duration.............: avg=29.66s     min=14.64s     med=29.02s     max=42.25s     p(90)=36.63s     p(95)=40.89s    
    iterations.....................: 1142   17.94265/s
    vus............................: 540    min=197       max=550
    vus_max........................: 550    min=550       max=550

    NETWORK
    data_received..................: 232 kB 3.6 kB/s
    data_sent......................: 88 kB  1.4 kB/s




running (1m03.6s), 000/550 VUs, 1142 complete and 0 interrupted iterations
complex_test ✓ [ 100% ] 00/50 VUs    1m0s  10.00 iters/s
io_test      ✓ [ 100% ] 000/500 VUs  1m0s  200.00 iters/s
